id,category,end_date,has_sought_acoba_advice,is_paid_as_director_of_payer,is_until_further_notice,job_title,link,member,mnis_id,parent_interest_id,payer_is_private_individual,payer_name,payer_nature_of_business,payer_public_address,published,registered,source_archive,start_date,summary,twfy_id,updated_1,updated_2,updated_3,updated_4,updated_5,updated_6,updated_7
10356,Employment and earnings,2024-07-04,,False,True,Health Spokesperson (Councillor),https://interests-api.parliament.uk/api/v1/Interests/10356,Graeme Downie,5275,,False,NHS FIfe,NHS Board,"Hayfield Road, Kirkcaldy, Fife KY2 5AH",2024-08-04,2024-08-04,Apr07_25,2023-09-25,Health Spokesperson (Councillor) - NHS FIfe,,,,,,,,
7434,Employment and earnings,2024-07-05,,False,True,Political Adviser to the General Secretary of the TUC,https://interests-api.parliament.uk/api/v1/Interests/7434,Anneliese Midgley,5038,,False,TUC,Trade Union,"Congress House, Great Russell Street WC1B 3LS",2024-08-04,2024-08-05,Apr07_25,,Political Adviser to the General Secretary of the TUC - TUC,,,,,,,,
8939,Employment and earnings,2024-07-10,,True,True,Chair of London Councils,https://interests-api.parliament.uk/api/v1/Interests/8939,Georgia Gould,5305,,False,London Councils,,59 1/2 Southwark Street SE1 0AL,2024-08-04,2024-08-02,Apr07_25,,Chair of London Councils - London Councils,,,,,,,,
9518,Employment and earnings,2024-07-02,,True,True,Deputy Chair & LGA Board Member,https://interests-api.parliament.uk/api/v1/Interests/9518,Michael Payne,5146,,False,Local Government Association,,"18 Smith Square, London SW1P 3HZ",2024-08-04,2024-08-02,Apr07_25,,Deputy Chair & LGA Board Member - Local Government Association,,,,,,,,
8832,Employment and earnings,2024-07-08,,False,True,Regional Lead Peer,https://interests-api.parliament.uk/api/v1/Interests/8832,Lisa Smart,5070,,False,Local Government Association,,"18 Smith Square, London SW1P 3HZ",2024-08-04,2024-08-02,Apr07_25,,Regional Lead Peer - Local Government Association,,,,,,,,
9225,Employment and earnings,2024-09-30,,False,True,External Examiner,https://interests-api.parliament.uk/api/v1/Interests/9225,Dr Scott Arthur,5212,,False,University of Bolton,Higher Education,"A676 Deane Rd, Bolton",2024-08-04,2024-08-02,Apr07_25,,External Examiner - University of Bolton,,,,,,,,
9945,Employment and earnings,2024-07-26,,False,True,Councillor in LB Tower Hamlets,https://interests-api.parliament.uk/api/v1/Interests/9945,Rachel Blake,5257,,False,LB Tower Hamlets,Local Authority,"Tower Hamlets Town Hall, Whitechapel Road, E1",2024-08-04,2024-08-03,Apr07_25,,Councillor in LB Tower Hamlets - LB Tower Hamlets,,,,,,,,
8817,Employment and earnings,2024-05-02,,False,True,Special responsibility allowance as an elected councillor,https://interests-api.parliament.uk/api/v1/Interests/8817,Lisa Smart,5070,,False,Greater Manchester Combined Authority,,"56 Oxford Street, Manchester",2024-08-04,2024-08-02,Apr07_25,,Special responsibility allowance as an elected councillor - Greater Manchester Combined Authority,,,,,,,,
8141,Employment and earnings,2024-10-31,,False,True,"Professor of International Relations, School of International Relations, and Assistant Vice-Principal International, University of St Andrews",https://interests-api.parliament.uk/api/v1/Interests/8141,Stephen Gethins,4434,,False,University of St Andrews,University,"North Street, St Andrews",2024-08-04,2024-07-30,Apr07_25,,"Professor of International Relations, School of International Relations, and Assistant Vice-Principal International, University of St Andrews - University of St Andrews",,2024-12-16,,,,,,
8539,Employment and earnings,,,False,False,County Councillor,https://interests-api.parliament.uk/api/v1/Interests/8539,Dr Lauren Sullivan,5269,,False,Kent County Council,,"County Hall, Maidstone, Kent ME14 1XQ",2024-08-04,2024-07-31,Apr07_25,2021-05-06,County Councillor - Kent County Council,,,,,,,,
9035,Employment and earnings,2024-07-18,,False,True,Chair of Urban Water Management,https://interests-api.parliament.uk/api/v1/Interests/9035,Dr Scott Arthur,5212,,False,Heriot-Watt University,Higher Education,"Edinburgh, EH14 4AS",2024-08-04,2024-08-02,Apr07_25,,Chair of Urban Water Management - Heriot-Watt University,,,,,,,,
9333,Employment and earnings,,,False,False,Media Appearance,https://interests-api.parliament.uk/api/v1/Interests/9333,David Davis,373,,False,MBC Dubai - Al Arabiya,TV Channel,"MBC Building 3, Dubai Media City P.O.Box 72627 Dubai United Arab Emirates",2024-08-04,2024-08-02,Apr07_25,,Media Appearance - MBC Dubai - Al Arabiya,,,,,,,,
8071,Employment and earnings,2024-07-17,,False,True,Party Representative,https://interests-api.parliament.uk/api/v1/Interests/8071,Bobby Dean,5083,,False,London Councils,Representative body of local authorities,"59 ½ Southwark Street, London SE1 0AL",2024-08-04,2024-08-02,Apr07_25,2023-07-18,Party Representative - London Councils,,,,,,,,
9233,Employment and earnings,,,False,False,Speaking engagement,https://interests-api.parliament.uk/api/v1/Interests/9233,Nigel Farage,5091,,False,AZ Liberty Network,,1835 E Elliot Road Suite 102 Tempe 85284,2024-08-04,2024-08-04,Apr07_25,,Speaking engagement - AZ Liberty Network,26352,,,,,,,
7640,Employment and earnings,2024-07-04,,False,True,Employee,https://interests-api.parliament.uk/api/v1/Interests/7640,Darren Paffey,5270,,False,University of Southampton,Higher Education,"University Road, Southampton SO17 1BJ",2024-08-04,2024-07-29,Apr07_25,,Employee - University of Southampton,,,,,,,,
7336,Employment and earnings,2024-07-05,,False,True,National Officer for Disability Equality,https://interests-api.parliament.uk/api/v1/Interests/7336,Deirdre Costigan,5075,,False,UNISON,,"Unison Centre, 130 Euston Road NW1 2AY",2024-08-04,2024-08-01,Apr07_25,,National Officer for Disability Equality - UNISON,,,,,,,,
7122,Employment and earnings,2024-07-19,,False,True,London Councils Executive Member,https://interests-api.parliament.uk/api/v1/Interests/7122,Jas Athwal,5227,,False,London Councils,Local Government,City of London Corporation,2024-08-04,2024-08-04,Apr07_25,,London Councils Executive Member - London Councils,,,,,,,,
7361,Employment and earnings,2024-08-08,,False,True,Councillor,https://interests-api.parliament.uk/api/v1/Interests/7361,Mr Jonathan Brash,5045,,False,Hartlepool Borough Council,Local Council,"Civic Centre, Victoria Road, Hartlepool TS24 8AY",2024-08-04,2024-07-30,Apr07_25,,Councillor - Hartlepool Borough Council,,,,,,,,
7517,Employment and earnings,2024-07-07,,False,True,"Executive Director of Policy, Advocacy and Campaigns",https://interests-api.parliament.uk/api/v1/Interests/7517,Kirsty McNeill,5114,,False,Save the Children UK,,"1 St John's Lane, London EC1M 4AR",2024-08-04,2024-07-25,Apr07_25,,"Executive Director of Policy, Advocacy and Campaigns - Save the Children UK",,,,,,,,
7380,Employment and earnings,,,False,False,County Councillor,https://interests-api.parliament.uk/api/v1/Interests/7380,Michelle Welsh,5226,,False,Nottinghamshire County Council,Local Government,"Nottinghamshire County Hall, West Bridgford, Nottinghamshire NG2 7QP",2024-08-04,2024-08-03,Apr07_25,,County Councillor - Nottinghamshire County Council,,,,,,,,
7153,Employment and earnings,,,False,False,Councillor,https://interests-api.parliament.uk/api/v1/Interests/7153,Peter Prinsley,5163,,False,Norwich City Council,,"Norwich City Hall, St Peters St, Norwich NR2 1NH",2024-08-04,2024-07-25,Apr07_25,,Councillor - Norwich City Council,,,,,,,,
8155,Employment and earnings,,,False,False,"Councillor, East Ayrshire Council",https://interests-api.parliament.uk/api/v1/Interests/8155,Lillian Jones,5043,,False,East Ayrshire Council,,"96 London Road, Kilmarnock KA3 7DD",2024-08-04,2024-07-30,Apr07_25,2024-08-30,"Councillor, East Ayrshire Council - East Ayrshire Council",,2024-09-17,,,,,,
7755,Employment and earnings,2024-07-04,,False,True,Office Manager Jon Cruddas MP,https://interests-api.parliament.uk/api/v1/Interests/7755,Margaret Mullane,5272,,False,IPSA,,"85 the Strand, London WC2R ODW",2024-08-04,2024-07-29,Apr07_25,,Office Manager Jon Cruddas MP - IPSA,,,,,,,,
8011,Employment and earnings,,,False,False,Connecting communities staff,https://interests-api.parliament.uk/api/v1/Interests/8011,Elaine Stewart,5206,,False,Coalfield regeneration trust,Coalfield regeneration trust,"2 Kirk Street, Kincardine, Alloa FK10 4PT",2024-08-04,2024-08-03,Apr07_25,,Connecting communities staff - Coalfield regeneration trust,,,,,,,,
8079,Employment and earnings,2024-07-31,,False,True,Consultancy work,https://interests-api.parliament.uk/api/v1/Interests/8079,Ian Sollom,5096,,False,2S Ltd,Strategy consultancy for business,"Tintagel House, 92 Embankment, London SE1 7TY",2024-08-04,2024-08-29,Apr07_25,,Consultancy work - 2S Ltd,,,,,,,,
7457,Employment and earnings,2024-07-08,,False,True,Superintendent Pharmacist,https://interests-api.parliament.uk/api/v1/Interests/7457,Sadik Al-Hassan,5312,,False,PillTime Ltd,Online Pharmacy,"Unit 7 and 8, The Laurels, Cribbs Causeway, Bristol BS10 7TT",2024-08-04,2024-07-25,Apr07_25,,Superintendent Pharmacist - PillTime Ltd,,,,,,,,
7429,Employment and earnings,2024-07-04,,False,True,Office of Conor McGinn MP,https://interests-api.parliament.uk/api/v1/Interests/7429,Anna Turley,4449,,False,IPSA,,"85 Strand, Marylebone WC2R 0DW",2024-08-04,2024-08-02,Apr07_25,,Office of Conor McGinn MP - IPSA,,,,,,,,
8158,Employment and earnings,2024-07-07,,False,True,Clinical Support,https://interests-api.parliament.uk/api/v1/Interests/8158,Lillian Jones,5043,,False,NHS Greater Glasgow and Clyde,,"1345 Govan Road, Glasgow G51 4TF",2024-08-04,2024-08-04,Apr07_25,,Clinical Support - NHS Greater Glasgow and Clyde,,,,,,,,
8606,Employment and earnings,2024-07-08,,False,True,General Manager,https://interests-api.parliament.uk/api/v1/Interests/8606,Jo Platt,4673,,False,Leigh Building Preservation Trust,"A preservation trust, regenerating Leigh Spinners Mill, providing space for small start-ups and social enterprise","Leigh Spinners Mill, Park Lane, Leigh WN7 2LB",2024-08-04,2024-07-31,Apr07_25,,General Manager - Leigh Building Preservation Trust,,,,,,,,
8216,Employment and earnings,2024-07-25,,False,True,Councillor and Cabinet Member,https://interests-api.parliament.uk/api/v1/Interests/8216,Tristan Osborne,5220,,False,Medway Council,Local Authority Council,"Gun Wharf, Dock Road, Chatham, Kent ME4 4TR",2024-08-04,2024-07-30,Apr07_25,,Councillor and Cabinet Member - Medway Council,,,,,,,,
8242,Employment and earnings,2024-07-08,,False,True,Assistant professor,https://interests-api.parliament.uk/api/v1/Interests/8242,Adam Thompson,5044,,False,University of Nottingham,,"Faculty of Engineering, University of Nottingham, Nottingham NG8 1BB",2024-08-04,2024-07-30,Apr07_25,,Assistant professor - University of Nottingham,,,,,,,,
7360,Employment and earnings,,,False,False,Councillor,https://interests-api.parliament.uk/api/v1/Interests/7360,Naushabah Khan,5215,,False,Medway Council,,"Gun Wharf, Dock Road, Chatham ME4 4TR",2024-08-04,2024-08-04,Apr07_25,,Councillor - Medway Council,,,,,,,,
7757,Employment and earnings,2024-07-05,,False,True,Employee,https://interests-api.parliament.uk/api/v1/Interests/7757,Andrew Pakes,5243,,False,Prospect,Trade union,"New Prospect House, 8 Leake Street, London SE1 7NN",2024-08-04,2024-07-29,Apr07_25,,Employee - Prospect,,,,,,,,
8042,Employment and earnings,2024-07-04,,False,True,Employee,https://interests-api.parliament.uk/api/v1/Interests/8042,Bradley Thomas,5186,,False,Baxi Heating UK Limited,Manufacturer of heating and cooling equipment,"Brooks House, Coventry Road, Warwick CV34 4LL",2024-08-04,2024-07-29,Apr07_25,,Employee - Baxi Heating UK Limited,,,,,,,,
10178,Employment and earnings,2024-08-09,,False,True,Employment Solicitor,https://interests-api.parliament.uk/api/v1/Interests/10178,Ben Maguire,5350,,False,Intel Corporation (UK) Ltd,Microchip design and manufacturing,"Pipers Way, Swindon SN3 1RJ",2024-08-04,2024-08-04,Apr07_25,,Employment Solicitor - Intel Corporation (UK) Ltd,,,,,,,,
7346,Employment and earnings,,,False,False,Councillor,https://interests-api.parliament.uk/api/v1/Interests/7346,Deirdre Costigan,5075,,False,London Borough of Ealing,,Ealing Town Hall W5 2BY,2024-08-04,2024-08-01,Apr07_25,,Councillor - London Borough of Ealing,,,,,,,,
7643,Employment and earnings,,,False,False,Local government councillor,https://interests-api.parliament.uk/api/v1/Interests/7643,Ben Coleman,5344,,False,London Borough of Hammersmith & Fulham,London Borough Council,"Town Hall, King Street, Hammersmith, London W6 9JU",2024-08-04,2024-07-31,Apr07_25,,Local government councillor - London Borough of Hammersmith & Fulham,,,,,,,,
8284,Employment and earnings,2024-07-12,,False,True,Councillor and Chief Whip,https://interests-api.parliament.uk/api/v1/Interests/8284,Lloyd Hatton,5217,,False,Camden Council,,"London Borough of Camden, 5 Pancras Square, Kings Cross London, N1C 4AG",2024-08-04,2024-08-04,Apr07_25,,Councillor and Chief Whip - Camden Council,,,,,,,,
10026,Employment and earnings,,,False,False,Councillor,https://interests-api.parliament.uk/api/v1/Interests/10026,Jonathan Davies,5256,,False,Chesterfield Borough Council,Local authority.,"Town Hall, Rose Hill, Chesterfield, Derbyshire S40 1LP.",2024-08-04,2024-08-04,Apr07_25,,Councillor - Chesterfield Borough Council,,,,,,,,
9521,Employment and earnings,2024-10-15,,True,True,Chair of Board of Trustees,https://interests-api.parliament.uk/api/v1/Interests/9521,Michael Payne,5146,,False,Local Government Information Unit,Local government (not-for-profit) membership organisation.,"251-255 Pentonville Road, London N1 9NG",2024-08-04,2024-08-02,Apr07_25,,Chair of Board of Trustees - Local Government Information Unit,,2024-10-12,,,,,,
6186,Employment and earnings,,False,False,False,Chief Executive,https://interests-api.parliament.uk/api/v1/Interests/6186,Andrew George,227,,False,Cornwall Community Land Trust,Charity housing,"The Penwith Centre, Parade St, Penzance TR18 2ES",2024-08-04,2024-08-04,Apr07_25,,Chief Executive - Cornwall Community Land Trust,,,,,,,,
7539,Employment and earnings,2024-08-04,,False,True,Voluntary Services Manager,https://interests-api.parliament.uk/api/v1/Interests/7539,Katrina Murray,5309,,False,NHS Lanarkshire,NHS Board,"Kirklands Hospital, Fallside Road, Bothwell G71 8BB",2024-08-04,2024-08-03,Apr07_25,,Voluntary Services Manager - NHS Lanarkshire,,,,,,,,
8018,Employment and earnings,,,False,False,Unitary  Councillor,https://interests-api.parliament.uk/api/v1/Interests/8018,Emily Darlington,5139,,False,Milton Keynes City Council,,1 Saxon Gate MK9 3EJ,2024-08-04,2024-08-02,Apr07_25,,Unitary  Councillor - Milton Keynes City Council,,,,,,,,
9757,Employment and earnings,2024-07-05,,False,True,Primary Care Communications Manager,https://interests-api.parliament.uk/api/v1/Interests/9757,Josh Newbury,5034,,False,NHS Birmingham and Solihull Integrated Care Board,NHS commissioning organisation,"Alpha Tower, Suffolk Street Queensway, Birmingham B1 1TT",2024-08-04,2024-08-04,Apr07_25,,Primary Care Communications Manager - NHS Birmingham and Solihull Integrated Care Board,,,,,,,,
8277,Employment and earnings,2024-07-05,,False,True,Policy and Campaigns Manager (Head of),https://interests-api.parliament.uk/api/v1/Interests/8277,Lloyd Hatton,5217,,False,Athena Foundation,Not-for-profit,"Acre House, 11/15 William Road, London NW1 3ER",2024-08-04,2024-08-04,Apr07_25,,Policy and Campaigns Manager (Head of) - Athena Foundation,,,,,,,,
7878,Employment and earnings,2024-07-29,,False,True,Councillor,https://interests-api.parliament.uk/api/v1/Interests/7878,Phil Brickell,5128,,False,Manchester City Council,,"City of Manchester, Town Hall, Manchester M60 2JR",2024-08-03,2024-07-30,Apr07_25,,Councillor - Manchester City Council,,,,,,,,
9883,Employment and earnings,,,False,False,Writer,https://interests-api.parliament.uk/api/v1/Interests/9883,Blair McDougall,5076,,True,Subscribers to my newsletter.,This payment is the aggregate subscription payments of around 50 subscribers to my newsletter.,,2024-08-03,2024-08-03,Apr07_25,,Writer - Subscribers to my newsletter.,,,,,,,,
7875,Employment and earnings,2024-07-15,,False,True,NatWest Group PLC,https://interests-api.parliament.uk/api/v1/Interests/7875,Phil Brickell,5128,,False,NatWest Group PLC,,"36 St Andrew Square, Edinburgh EH2 2YB",2024-08-03,2024-08-01,Apr07_25,,NatWest Group PLC - NatWest Group PLC,,,,,,,,
8008,Employment and earnings,2024-07-05,,False,True,Project manager,https://interests-api.parliament.uk/api/v1/Interests/8008,Elaine Stewart,5206,,False,The Zone Initiative Limited,Local charity for children and young people,"12 High Main Street, Dalmellington KA67QN",2024-08-02,2024-08-02,Apr07_25,,Project manager - The Zone Initiative Limited,,,,,,,,
6542,Employment and earnings,2025-01-31,,False,True,Tribunal member for PSA (phone paid services/ofcom),https://interests-api.parliament.uk/api/v1/Interests/6542,Martin Wrigley,5111,,False,PSA - Phone Paid Services Authority,Telecoms regulator,"c/o Ofcom, Riverside House. 2a Southwark Bridge Road, London SE1 9HA",2024-08-02,2024-08-02,Apr07_25,,Tribunal member for PSA (phone paid services/ofcom) - PSA - Phone Paid Services Authority,,2024-11-25,,,,,,
7633,Employment and earnings,,,False,False,Local Authority Councillor,https://interests-api.parliament.uk/api/v1/Interests/7633,Baggy Shanker,5176,,False,Derby City Council,Local Authority,"Council House, Corporation Street, Derby DE1 2FS",2024-08-02,2024-08-02,Apr07_25,2008-05-04,Local Authority Councillor - Derby City Council,,,,,,,,
7629,Employment and earnings,2024-06-30,,False,True,Project Manager,https://interests-api.parliament.uk/api/v1/Interests/7629,Baggy Shanker,5176,,False,Rolls-Royce Civil Aerospace,,"Victory Road, Derby DE24 9HX",2024-08-02,2024-08-02,Apr07_25,,Project Manager - Rolls-Royce Civil Aerospace,,,,,,,,
7008,Employment and earnings,,,False,False,Borough Councillor & Deputy Leader of the Council (Deputy Leader up to 14 October 2024),https://interests-api.parliament.uk/api/v1/Interests/7008,Michael Payne,5146,,False,Gedling Borough Council,,"Civic Centre, Arnot Hill Park, Arnold, Nottingham NG5 6LU",2024-08-02,2024-08-02,Apr07_25,,Borough Councillor & Deputy Leader of the Council (Deputy Leader up to 14 October 2024) - Gedling Borough Council,,2024-11-20,,,,,,
6095,Employment and earnings,2024-07-05,,False,True,Local government officer,https://interests-api.parliament.uk/api/v1/Interests/6095,Maya Ellis,5228,,False,Lancashire County Council,,"County Hall, Preston PR1 8RL",2024-08-02,2024-08-02,Apr07_25,,Local government officer - Lancashire County Council,,,,,,,,
9220,Employment and earnings,2024-09-30,,False,True,External Examiner,https://interests-api.parliament.uk/api/v1/Interests/9220,Dr Scott Arthur,5212,,False,University College London,Higher Education,"Gower St, London WC1E 6BT",2024-08-02,2024-08-02,Apr07_25,,External Examiner - University College London,,,,,,,,
9298,Employment and earnings,2024-07-05,,False,True,Senior Advisor,https://interests-api.parliament.uk/api/v1/Interests/9298,Anna Gelderd,5353,,False,Oceana,Conservation Charity,"C/O Bates Wells & Braithwaite, 10 Queen Street Place, London EC4R 1BE",2024-08-02,2024-08-02,Apr07_25,,Senior Advisor - Oceana,,,,,,,,
7612,Employment and earnings,2024-07-05,,False,True,Head of Campaigns and External Affairs,https://interests-api.parliament.uk/api/v1/Interests/7612,Richard Baker,5253,,False,Enable,Disability third sector organisation.,"Inspire House, 3 Renshaw Place, Eurocentral, Lanarkshire ML1 4UF",2024-08-02,2024-07-26,Apr07_25,,Head of Campaigns and External Affairs - Enable,,,,,,,,
9160,Employment and earnings,2024-07-05,,False,True,Chief Executive Officer,https://interests-api.parliament.uk/api/v1/Interests/9160,Adrian Ramsay,5320,,False,MCS Charitable Foundation,"Charity advocating for decarbonising homes, heat and energy","First Floor, Violet 3, Sci-Tech Daresbury, Keckwick Lane, Chesire WA4 4AB",2024-08-02,2024-08-02,Apr07_25,,Chief Executive Officer - MCS Charitable Foundation,,,,,,,,
6136,Employment and earnings,2024-07-11,,False,True,Leader of Camden Council,https://interests-api.parliament.uk/api/v1/Interests/6136,Georgia Gould,5305,,False,Camden council,,"5 Pancras Square, London N1C 4AG",2024-08-02,2024-08-02,Apr07_25,,Leader of Camden Council - Camden council,,,,,,,,
9486,Employment and earnings,,,False,False,County Councillor,https://interests-api.parliament.uk/api/v1/Interests/9486,Michael Payne,5146,,False,Nottinghamshire County Council,,"County Hall, Loughborough Road, West Bridgford, Nottinghamshire NG2 7PQ",2024-08-02,2024-08-02,Apr07_25,,County Councillor - Nottinghamshire County Council,,,,,,,,
6326,Employment and earnings,,,False,False,Councillor for Cornwall Council,https://interests-api.parliament.uk/api/v1/Interests/6326,Jayne Kirkham,5279,,False,Cornwall Council,unitary council,"Cornwall Council, Treyew Road, Truro, Cornwall TR1 3AY",2024-08-02,2024-08-02,Apr07_25,,Councillor for Cornwall Council - Cornwall Council,,,,,,,,
6850,Employment and earnings,,,False,False,Unitary Councillor,https://interests-api.parliament.uk/api/v1/Interests/6850,Brian Mathew,5214,,False,Wiltshire Council,,"County Hall, Bythesea road, Trowbridge, Wiltshire BA14 8JN",2024-08-02,2024-08-02,Apr07_25,,Unitary Councillor - Wiltshire Council,,,,,,,,
8634,Employment and earnings,2024-07-31,,False,True,Chair (until 31 May 2024) and Board Member of City Regions Board LGA,https://interests-api.parliament.uk/api/v1/Interests/8634,Satvir Kaur,5271,,False,Local Government Association,,"18 Smith Square, London SW1P 3HZ",2024-08-02,2024-08-02,Apr07_25,,Chair (until 31 May 2024) and Board Member of City Regions Board LGA - Local Government Association,,,,,,,,
6378,Employment and earnings,2024-07-04,,False,True,Solicitor,https://interests-api.parliament.uk/api/v1/Interests/6378,Alex McIntyre,5349,,False,DAC Beachcroft LLP,Solicitors Firm,"The Walbrook Building, 25 Walbrook, London EC4N 8AF",2024-08-02,2024-08-02,Apr07_25,,Solicitor - DAC Beachcroft LLP,,,,,,,,
6397,Employment and earnings,2024-07-08,,False,True,Council Leader,https://interests-api.parliament.uk/api/v1/Interests/6397,Dr Beccy Cooper,5307,,False,Worthing Borough Council,,"Town Hall, Chapel Rd, Worthing BN11 1HA",2024-08-02,2024-08-02,Apr07_25,,Council Leader - Worthing Borough Council,,2024-09-15,,,,,,
6581,Employment and earnings,2024-08-23,,False,True,Associate Lecturer,https://interests-api.parliament.uk/api/v1/Interests/6581,Manuela Perteghella,5122,,False,The Open University,"University, higher education institution","Walton Hall, Milton Keynes MK7 6AA",2024-08-01,2024-08-01,Apr07_25,,Associate Lecturer - The Open University,,,,,,,,
6655,Employment and earnings,2024-07-25,,False,True,Principal Consultant,https://interests-api.parliament.uk/api/v1/Interests/6655,Olly Glover,5318,,False,AtkinsRéalis,"Multi-national engineering, services, and consultancy firm","Woodcote Grove, Ashley Road, Epsom, Surrey KT18 5BW",2024-08-01,2024-08-01,Apr07_25,,Principal Consultant - AtkinsRéalis,,,,,,,,
8956,Employment and earnings,,,False,False,Councillor allowance,https://interests-api.parliament.uk/api/v1/Interests/8956,Lauren Edwards,5298,,False,Medway Council,Unitary Local Authority,"Gun Wharf, Dock Road, Chatham, ME4 4TR",2024-08-01,2024-08-01,Apr07_25,,Councillor allowance - Medway Council,,,,,,,,
6588,Employment and earnings,2024-07-08,,True,True,Director and employee,https://interests-api.parliament.uk/api/v1/Interests/6588,Manuela Perteghella,5122,,False,Environmental Policy Consulting,consultancy on environmental policy,"29 Wood Street, Stratford-Upon-Avon, Warwickshire CV37 6JG",2024-08-01,2024-08-01,Apr07_25,,Director and employee - Environmental Policy Consulting,,,,,,,,
8577,Employment and earnings,2024-07-18,,False,True,"Vice Chair, London Councils Transport & Environment Committee",https://interests-api.parliament.uk/api/v1/Interests/8577,Deirdre Costigan,5075,,False,London Councils,,"59½ Southwark Street, London, SE1 0AL",2024-08-01,2024-08-01,Apr07_25,,"Vice Chair, London Councils Transport & Environment Committee - London Councils",,,,,,,,
8176,Employment and earnings,,,False,False,Councillor,https://interests-api.parliament.uk/api/v1/Interests/8176,Pam Cox,5042,,False,Colchester City Council,Local Authority,"Rowan House, Sheepen Road, Colchester CO3 3WG",2024-08-01,2024-07-30,Apr07_25,,Councillor - Colchester City Council,,,,,,,,
7108,Employment and earnings,,False,False,False,Speaking engagement,https://interests-api.parliament.uk/api/v1/Interests/7108,Bridget Phillipson,4046,,False,Labour North West,Labour North West regional party,"Rutherford House, Floor 2, Suite 6B Warrington Road, Birchwood WA3 6ZH",2024-08-01,2024-08-01,Apr07_25,,Speaking engagement - Labour North West,,,,,,,,
6152,Employment and earnings,,,False,False,Councillor,https://interests-api.parliament.uk/api/v1/Interests/6152,Alison Bennett,5283,,False,Mid Sussex District Council,,"Oaklands Rd, Haywards Heath RH16 1SS",2024-08-01,2024-08-01,Apr07_25,,Councillor - Mid Sussex District Council,,,,,,,,
6258,Employment and earnings,,,True,False,Director,https://interests-api.parliament.uk/api/v1/Interests/6258,Alison Griffiths,5203,,True,Gisborne Ltd,"Strategy and Marketing Consulting, Technology Sector",,2024-08-01,2024-08-01,Apr07_25,,Director - Gisborne Ltd,,,,,,,,
6428,Employment and earnings,2024-09-02,,False,True,Local Authority Councillor,https://interests-api.parliament.uk/api/v1/Interests/6428,Patricia Ferguson,5190,,False,Glasgow City Council,,"City Chamber, George Square, Glasgow G2 1DU",2024-08-01,2024-08-01,Apr07_25,2022-05-03,Local Authority Councillor - Glasgow City Council,,2024-10-14,,,,,,
