id,category,end_date,has_sought_acoba_advice,is_paid_as_director_of_payer,is_until_further_notice,job_title,link,member,mnis_id,parent_interest_id,payer_is_private_individual,payer_name,payer_nature_of_business,payer_public_address,published,registered,source_archive,start_date,summary,twfy_id,updated_1,updated_2,updated_3,updated_4,updated_5,updated_6,updated_7
7276,Employment and earnings,2024-07-11,,False,True,Councillor,https://interests-api.parliament.uk/api/v1/Interests/7276,Connor Naismith,5273,,False,Cheshire East Council,Local Authority,"Westfields, Middlewich Road, Sandbach, Cheshire CW11 1HZ",2024-07-24,2024-07-24,Apr07_25,,Councillor - Cheshire East Council,,,,,,,,
6972,Employment and earnings,2024-05-28,,False,True,Councillor,https://interests-api.parliament.uk/api/v1/Interests/6972,Andrew Cooper,5195,,False,Cheshire West and Chester Council,,"The Portal, Wellington Road, Ellesmere Port, CH65 0BA",2024-07-23,2024-07-23,Apr07_25,,Councillor - Cheshire West and Chester Council,,,,,,,,
6867,Employment and earnings,2024-08-31,,False,True,"Councillor (and until 17 July 2024, Council Leader)",https://interests-api.parliament.uk/api/v1/Interests/6867,Mr Paul Foster,5074,,False,South Ribble Borough Council,,"West Paddock, Leyland, Lancashire PR25 1DH",2024-07-23,2024-07-23,Apr07_25,,"Councillor (and until 17 July 2024, Council Leader) - South Ribble Borough Council",,2024-09-02,,,,,,
6996,Employment and earnings,,,False,False,Head of Partnerships,https://interests-api.parliament.uk/api/v1/Interests/6996,Lee Pitcher,5233,,False,Yorkshire Water,,"Western House, Western Way, Halifax Road, Bradford BD6 2SZ",2024-07-23,2024-07-23,Apr07_25,,Head of Partnerships - Yorkshire Water,,,,,,,,
6970,Employment and earnings,2024-07-04,,False,True,Software Development Director,https://interests-api.parliament.uk/api/v1/Interests/6970,Andrew Cooper,5195,,False,MIS Active Management Systems Limited,Provider of software and services to the social housing sector,"Charnwood House, Gadbrook Business Centre, Northwich CW9 7UG",2024-07-23,2024-07-23,Apr07_25,,Software Development Director - MIS Active Management Systems Limited,,,,,,,,
6789,Employment and earnings,2024-07-03,,True,True,Secretary,https://interests-api.parliament.uk/api/v1/Interests/6789,Luke Akehurst,5112,,True,Labour First Ltd,Political organisation within the Labour Party,,2024-07-22,2024-07-22,Apr07_25,,Secretary - Labour First Ltd,,,,,,,,
6904,Employment and earnings,2024-07-04,,False,True,Employment: Senior Communications Manager,https://interests-api.parliament.uk/api/v1/Interests/6904,Matthew Patrick,5162,,False,Pay.UK,Payment Systems Operator,"2 Thomas More Square, London E1W 1YN",2024-07-22,2024-07-22,Apr07_25,,Employment: Senior Communications Manager - Pay.UK,,,,,,,,
6022,Employment and earnings,2024-07-19,,False,True,Media Planning Manager,https://interests-api.parliament.uk/api/v1/Interests/6022,Natasha Irons,5119,,False,Channel 4 Television,Television broadcaster,"124 Horseferry Road, London SW1P 2TX",2024-07-22,2024-07-22,Apr07_25,2008-02-25,Media Planning Manager - Channel 4 Television,,,,,,,,
6777,Employment and earnings,2024-10-11,,False,True,District Councillor,https://interests-api.parliament.uk/api/v1/Interests/6777,John Milne,5329,,False,Horsham District Council,,"Park House, North Street, Horsham RH12 1RL",2024-07-22,2024-07-22,Apr07_25,2019-05-06,District Councillor - Horsham District Council,,2024-11-06,,,,,,
6079,Employment and earnings,,,False,False,Councillor,https://interests-api.parliament.uk/api/v1/Interests/6079,Luke Taylor,5103,,False,London Borough of Sutton,Local Authority,"St Nicholas Way, Sutton SM1 1EA",2024-07-22,2024-07-22,Apr07_25,,Councillor - London Borough of Sutton,,,,,,,,
6790,Employment and earnings,2024-07-03,,False,True,Director,https://interests-api.parliament.uk/api/v1/Interests/6790,Luke Akehurst,5112,,False,We Believe in Israel,Pro-Israel campaign organisation,"First Floor, 5 Fleet Place, London EC4M 7RD",2024-07-22,2024-07-22,Apr07_25,,Director - We Believe in Israel,,,,,,,,
6783,Employment and earnings,2024-07-19,,True,True,Communications Advice (Own business),https://interests-api.parliament.uk/api/v1/Interests/6783,Graeme Downie,5275,,True,Crimson Bridge Communications,Communications Advice (Member's Own Business),,2024-07-22,2024-07-22,Apr07_25,,Communications Advice (Own business) - Crimson Bridge Communications,,,,,,,,
6753,Employment and earnings,2024-07-21,,False,True,Councillor,https://interests-api.parliament.uk/api/v1/Interests/6753,Graeme Downie,5275,,False,Fife Council,Fife Council (Local Government),"Fife House, North Street Glenrothes KY7 5LT",2024-07-19,2024-07-19,Apr07_25,,Councillor - Fife Council,,,,,,,,
6771,Employment and earnings,2025-03-12,,False,True,District Councillor,https://interests-api.parliament.uk/api/v1/Interests/6771,Matt Bishop,5323,,False,Forest of Dean District Council,,"High Street, Coleford GL16 8HG",2024-07-19,2024-07-19,Apr07_25,,District Councillor - Forest of Dean District Council,,2025-03-12,,,,,,
6768,Employment and earnings,2024-07-05,,False,True,Head of Labour Link,https://interests-api.parliament.uk/api/v1/Interests/6768,Mark Ferguson,5031,,False,UNISON,Trade Union,"130 Euston Road, London NW1 2AY",2024-07-19,2024-07-19,Apr07_25,2016-01-01,Head of Labour Link - UNISON,,,,,,,,
6700,Employment and earnings,2024-07-09,,False,True,Strategy and Exit Planning Executive,https://interests-api.parliament.uk/api/v1/Interests/6700,Noah Law,5302,,False,British International Investment plc,,"123 Victoria Street, London, SW1E 6DE",2024-07-19,2024-07-19,Apr07_25,,Strategy and Exit Planning Executive - British International Investment plc,,,,,,,,
6115,Employment and earnings,2024-07-31,,False,True,Advisor,https://interests-api.parliament.uk/api/v1/Interests/6115,Shaun Davies,5041,,False,Local Government Association,,"Smith Square, London SW1P 3HZ",2024-07-19,2024-07-18,Apr07_25,2024-07-05,Advisor - Local Government Association,,,,,,,,
6686,Employment and earnings,,,False,False,Councillor,https://interests-api.parliament.uk/api/v1/Interests/6686,John Whitby,5342,,False,Derby City Council,,"Corporation Street, Derby DE1 2FS",2024-07-19,2024-07-19,Apr07_25,,Councillor - Derby City Council,,,,,,,,
6733,Employment and earnings,2024-07-05,,True,True,Director,https://interests-api.parliament.uk/api/v1/Interests/6733,Sir Ashley Fox,5101,,True,Ashley Fox Consulting Ltd,,,2024-07-19,2024-07-19,Apr07_25,,Director - Ashley Fox Consulting Ltd,,,,,,,,
6670,Employment and earnings,,,False,False,Councillor,https://interests-api.parliament.uk/api/v1/Interests/6670,Cat Eccles,5293,,False,Dudley Metropolitan Borough Council,,"Council House, 1 Priory Road, Dudley DY1 1HJ",2024-07-18,2024-07-18,Apr07_25,,Councillor - Dudley Metropolitan Borough Council,,,,,,,,
6107,Employment and earnings,,,False,False,"Councillor, and until 17 July 2024, Council Leader",https://interests-api.parliament.uk/api/v1/Interests/6107,Shaun Davies,5041,,False,Telford and Wrekin Council,Local Government,"Telford and Wrekin Council,  Southwater 1, Telford TF34JG",2024-07-18,2024-07-18,Apr07_25,,"Councillor, and until 17 July 2024, Council Leader - Telford and Wrekin Council",,2024-08-30,,,,,,
6249,Employment and earnings,2024-09-02,,False,True,District Councillor,https://interests-api.parliament.uk/api/v1/Interests/6249,Chris Hinchliff,5244,,False,North Herts District Council,,"North Herts Council, Gernon Road, Letchworth Garden City SG6 3JF",2024-07-18,2024-07-18,Apr07_25,,District Councillor - North Herts District Council,,2024-09-30,,,,,,
6656,Employment and earnings,2024-07-05,,False,True,Regional Secretary,https://interests-api.parliament.uk/api/v1/Interests/6656,Lee Barron,5315,,False,Trades Union Congress,,"TUC, Great Russell Street, London WC1B 3LS",2024-07-18,2024-07-18,Apr07_25,,Regional Secretary - Trades Union Congress,,,,,,,,
6078,Employment and earnings,2024-10-05,,False,True,Managing Consultant,https://interests-api.parliament.uk/api/v1/Interests/6078,Luke Taylor,5103,,False,Ricondo,Aviation Consulting,"1 Lyric Square, London W6 0NB",2024-07-17,2024-07-11,Apr07_25,,Managing Consultant - Ricondo,,2024-10-27,,,,,,
5956,Employment and earnings,,False,False,False,Giving a speech,https://interests-api.parliament.uk/api/v1/Interests/5956,Jess Phillips,4370,,False,Tyndallwoods Solicitors,,"29 Woodbourne Road, Edgbaston, Birmingham B17 8BY",2024-07-17,2024-07-17,Apr07_25,,Giving a speech - Tyndallwoods Solicitors,,,,,,,,
6525,Employment and earnings,2024-05-23,,False,True,Managing Director,https://interests-api.parliament.uk/api/v1/Interests/6525,Emma Reynolds,4077,,False,TheCityUK,Industry body,"Fitzwilliam House, 10 St Mary Axe, London EC3A 8BF",2024-07-17,2024-07-17,Apr07_25,,Managing Director - TheCityUK,,,,,,,,
6457,Employment and earnings,2024-07-17,,False,True,Campaign Manager,https://interests-api.parliament.uk/api/v1/Interests/6457,Mr Will Forster,5322,,False,Liberal Democrats,,"1 Vincent Square, London SW1P 2PN",2024-07-16,2024-07-16,Apr07_25,,Campaign Manager - Liberal Democrats,,,,,,,,
6003,Employment and earnings,,,False,False,Councillor,https://interests-api.parliament.uk/api/v1/Interests/6003,Danny Beales,5339,,False,London borough of Camden,,"Camden Town Hall, Judd street, London WC1H 9JE",2024-07-16,2024-07-16,Apr07_25,,Councillor - London borough of Camden,,,,,,,,
6478,Employment and earnings,2024-07-04,,False,True,Self-employed landscaper,https://interests-api.parliament.uk/api/v1/Interests/6478,Adam Dance,5191,,True,Myself,,,2024-07-16,2024-07-16,Apr07_25,,Self-employed landscaper - Myself,,,,,,,,
6486,Employment and earnings,,,False,False,County Councillor,https://interests-api.parliament.uk/api/v1/Interests/6486,Lizzi Collinge,5225,,False,Lancashire County Councillor,,"PO Box 78, County Hall, Fishergate, Preston, Lancashire PR1 8XJ",2024-07-16,2024-07-16,Apr07_25,,County Councillor - Lancashire County Councillor,,,,,,,,
6141,Employment and earnings,2024-07-05,,False,True,Neighbourhood Housing Officer,https://interests-api.parliament.uk/api/v1/Interests/6141,Sean Woodcock,5328,,False,Cottsway Housing,Housing Association (third sector),"Cottsway House, Heynes Place, Avenue Two, Station Lane, Witney, Oxon OX28 4YG",2024-07-16,2024-07-16,Apr07_25,,Neighbourhood Housing Officer - Cottsway Housing,,,,,,,,
6051,Employment and earnings,2024-07-04,,False,True,NAHT MAT Engagement Officer,https://interests-api.parliament.uk/api/v1/Interests/6051,Amanda Martin,5294,,False,National Association Head Teachers,Education Trade Union,"NAHT HQ Millbank Tower, London SW1P 4QP",2024-07-16,2024-07-10,Apr07_25,,NAHT MAT Engagement Officer - National Association Head Teachers,,,,,,,,
6394,Employment and earnings,2024-07-08,,False,True,"Senior Manager, Fraud and Compliance",https://interests-api.parliament.uk/api/v1/Interests/6394,Mr Luke Charters,5199,,False,Remote Technology Services Ltd,Financial Services,"5 New Street Square, London EC4A 3TW",2024-07-16,2024-07-16,Apr07_25,,"Senior Manager, Fraud and Compliance - Remote Technology Services Ltd",,,,,,,,
6268,Employment and earnings,2024-07-05,,False,True,Hertfordshire Deputy Police and Crime Commissioner,https://interests-api.parliament.uk/api/v1/Interests/6268,Lewis Cocking,5050,,False,Hertfordshire Police and Crime Commissioner,,"Harpenden Police Station, 13 Vaughan Road Harpenden, Hertfordshire, AL5 4GZ",2024-07-15,2024-07-15,Apr07_25,,Hertfordshire Deputy Police and Crime Commissioner - Hertfordshire Police and Crime Commissioner,,,,,,,,
6111,Employment and earnings,,,False,False,Government,https://interests-api.parliament.uk/api/v1/Interests/6111,Peter Lamb,5345,,False,Crawley Borough Council,,"Town Hall, The Boulevard, Crawley RH10 1UZ",2024-07-11,2024-07-11,Apr07_25,,Government - Crawley Borough Council,,,,,,,,
6108,Employment and earnings,2024-07-05,,False,True,Public affairs,https://interests-api.parliament.uk/api/v1/Interests/6108,Peter Lamb,5345,,False,CIPD,Chartered body for the Human Resources profession,"151 The Broadway, London, SW19 1JQ",2024-07-11,2024-07-11,Apr07_25,,Public affairs - CIPD,,,,,,,,
6077,Employment and earnings,2024-07-05,,False,True,Solicitor,https://interests-api.parliament.uk/api/v1/Interests/6077,Sarah Bool,5355,,False,Forsters LLP,Law Firm,"22 Baker Street, London W1U 3BW",2024-07-11,2024-07-11,Apr07_25,,Solicitor - Forsters LLP,,,,,,,,
6116,Employment and earnings,2024-06-30,,True,True,Director,https://interests-api.parliament.uk/api/v1/Interests/6116,David Burton-Sampson,5106,,True,DBS Financial Solutions Ltd,Mortgage and Insurance Brokerage,,2024-07-11,2024-07-11,Apr07_25,,Director - DBS Financial Solutions Ltd,,,,,,,,
6069,Employment and earnings,2024-05-10,False,False,True,Writing an essay for publication in a compendium,https://interests-api.parliament.uk/api/v1/Interests/6069,Claire Coutinho,4806,,False,Axel and Margaret Ax:son Johnson Foundation,Charitable and scholarly foundation,"Stureplan 3, SE-103 75 Stockholm, Sweden",2024-07-10,2024-07-10,Apr07_25,,Writing an essay for publication in a compendium - Axel and Margaret Ax:son Johnson Foundation,,,,,,,,
5222,Employment and earnings,,,False,False,Writing article,https://interests-api.parliament.uk/api/v1/Interests/5222,Ms Diane Abbott,172,,False,Guardian News & Media Ltd,publication,"Kings Place, 90 York Way, London N1P 2AP",2024-06-03,,Apr07_25,,Writing article - Guardian News & Media Ltd,,,,,,,,
5770,Employment and earnings,,,False,False,Speaking Engagements,https://interests-api.parliament.uk/api/v1/Interests/5770,Catherine McKinnell,4125,,False,XTX Markets,,"R7, 14-18 Handyside Street, London N1C 4DN",2024-05-17,,Apr07_25,,Speaking Engagements - XTX Markets,,,,,,,,
5606,Employment and earnings,,False,False,False,Interview Fee,https://interests-api.parliament.uk/api/v1/Interests/5606,Bell Ribeiro-Addy,4764,,False,Faber and Faber,Independent Publishing House,"The Bindery, 51 Hatton Garden, London EC1N 8HN",2024-05-14,,Apr07_25,,Interview Fee - Faber and Faber,,,,,,,,
5421,Employment and earnings,2024-09-30,True,False,True,Chair of Science and Technology Advisory Board,https://interests-api.parliament.uk/api/v1/Interests/5421,George Freeman,4020,,False,Eastern Powerhouse,,"42 Tavistock Street, London WC2E 7PB",2024-04-24,,Apr07_25,2024-03-18,Chair of Science and Technology Advisory Board - Eastern Powerhouse,,2024-10-15,,,,,,
5388,Employment and earnings,,,False,False,Speaking Engagement,https://interests-api.parliament.uk/api/v1/Interests/5388,Simon Lightwood,4943,,False,WA Communications,,"6th Floor, Artillery House, Artillery Row, London SW1P 1RT",2024-04-23,,Apr07_25,,Speaking Engagement - WA Communications,,,,,,,,
5123,Employment and earnings,2024-03-31,,True,True,Director,https://interests-api.parliament.uk/api/v1/Interests/5123,Richard Fuller,3912,,False,Impero Holdings Ltd,a software company,"2 Tollhouse Hill, Nottingham NG1 5FS",2024-04-15,,Apr07_25,2023-04-01,Director - Impero Holdings Ltd,,2024-04-15,,,,,,
5298,Employment and earnings,,,False,False,Writing one article,https://interests-api.parliament.uk/api/v1/Interests/5298,Lee Anderson,4743,,False,Daily Express,,"One Canada Square, Canary Wharf, London E14 5AP",2024-04-15,,Apr07_25,,Writing one article - Daily Express,,,,,,,,
5193,Employment and earnings,,True,False,False,Writing articles,https://interests-api.parliament.uk/api/v1/Interests/5193,Suella Braverman,4475,,False,Telegraph Media Group Ltd,,"111 Buckingham Palace Road, London SW1W 0DT",2024-04-10,,Apr07_25,,Writing articles - Telegraph Media Group Ltd,,2024-04-25,,,,,,
5025,Employment and earnings,2024-05-07,,False,True,Legal consultant,https://interests-api.parliament.uk/api/v1/Interests/5025,Sir Jeremy Wright,1560,,False,Bird and Bird LLP,Law firm,"12 New Fetter Lane, London EC4A 1JP",2024-03-18,,Apr07_25,2022-10-06,Legal consultant - Bird and Bird LLP,,2024-05-15,,,,,,
4970,Employment and earnings,2024-10-24,,False,True,Marketing advisory services,https://interests-api.parliament.uk/api/v1/Interests/4970,Mark Pritchard,1576,,False,ATS Group,an industrial manufacturing and technology business,"1550, No. 17 Industrial Zone Vizbegovo, Skopje, North Macedonia",2024-03-18,,Apr07_25,2023-11-01,Marketing advisory services - ATS Group,,2024-11-19,,,,,,
4367,Employment and earnings,,,False,False,Broadcast appearances,https://interests-api.parliament.uk/api/v1/Interests/4367,Jess Phillips,4370,,False,News UK & Ireland,,"1 London Bridge St, London SE1 9GF",2024-03-18,,Apr07_25,,Broadcast appearances,,,,,,,,
4828,Employment and earnings,2024-04-17,,False,True,Consultancy advice,https://interests-api.parliament.uk/api/v1/Interests/4828,Barry Gardiner,146,,False,World Climate Initiative,,"8th Floor, 167 Fleet Street, London EC3A 2EA",2024-03-18,,Apr07_25,2022-11-22,Consultancy advice - World Climate Initiative,,,,,,,,
3830,Employment and earnings,,,False,False,Participating in a seminar,https://interests-api.parliament.uk/api/v1/Interests/3830,Sir Mark Tami,1383,,False,Eden Partners,,"50 Broadway, London SW1H 0RG",2024-03-18,,Apr07_25,,Participating in a seminar,,,,,,,,
3888,Employment and earnings,,,False,False,Writing articles,https://interests-api.parliament.uk/api/v1/Interests/3888,Chris Bryant,1446,,False,Guardian News & Media Ltd,,"Kings Place, 90 York Way, London N1 9GU",2024-03-18,,Apr07_25,,Writing articles,,,,,,,,
3825,Employment and earnings,,,False,False,Writing a book and recording an audio book,https://interests-api.parliament.uk/api/v1/Interests/3825,Wes Streeting,4504,,False,United Agents Ltd,,"12-26 Lexington Street, London W1F 0LE",2024-03-18,2022-05-17,Apr07_25,,Writing a book and recording an audio book,,2023-03-24,,,,,,
4515,Employment and earnings,,,False,False,Writing articles,https://interests-api.parliament.uk/api/v1/Interests/4515,Ms Stella Creasy,4088,,False,Guardian news and media,,"90 York Way, London N1 9GU",2024-03-18,,Apr07_25,,Writing articles,,,,,,,,
4172,Employment and earnings,,,False,False,Legal services,https://interests-api.parliament.uk/api/v1/Interests/4172,Sir Geoffrey Cox,1508,,False,Khan Partnership Solicitors,,"48-49 Russell Square, London WC1B 4JP",2024-03-18,,Apr07_25,,Legal services,,,,,,,,
3942,Employment and earnings,,,False,False,Writing articles,https://interests-api.parliament.uk/api/v1/Interests/3942,Alicia Kearns,4805,,False,Reach PLC,commercial news publisher,"One Canada Square, London E14 5AP",2024-03-16,,Apr07_25,,Writing articles,,,,,,,,
4205,Employment and earnings,,,False,False,Writing an article,https://interests-api.parliament.uk/api/v1/Interests/4205,David Davis,373,,False,ANMFS LTD (Mail Group),,"Northcliffe House, 2 Derry Street, Kensington, London W8 5TT",2024-03-16,,Apr07_25,,Writing an article,,,,,,,,
4045,Employment and earnings,,,False,False,Councillor,https://interests-api.parliament.uk/api/v1/Interests/4045,Andrew Western,4979,,False,Trafford Council,,"Talbot Road, Stretford M32 0TH",2024-03-16,,Apr07_25,,Councillor,,,,,,,,
3938,Employment and earnings,,,False,False,Speaking engagements,https://interests-api.parliament.uk/api/v1/Interests/3938,Mr David Lammy,206,,False,The Speaking Office,,"Unit 31 Highbury Studios, 10 Hornsey Street, London N7 8EL",2024-03-16,,Apr07_25,,Speaking engagements,,2021-04-15,,,,,,
5236,Employment and earnings,2021-06-06,,False,True,Locum Pharmacist for Tesco,https://interests-api.parliament.uk/api/v1/Interests/5236,Taiwo Owatemi,4779,,False,Tesco,,"Shire Park, Kestrel Way, Welwyn Garden City AL7 1GA",2024-03-15,2021-06-07,Apr07_25,2021-06-05,Locum Pharmacist for Tesco - Tesco,,2024-05-16,,,,,,
3704,Employment and earnings,,,False,False,Writing an article,https://interests-api.parliament.uk/api/v1/Interests/3704,Rosie Duffield,4616,,False,UnHerd,,"6 Old Queen Street, London SW1H 9HP",2024-03-13,,Apr07_25,,Writing an article - UnHerd,,,,,,,,
3723,Employment and earnings,,,False,False,Presenting radio shows on LBC,https://interests-api.parliament.uk/api/v1/Interests/3723,Mr David Lammy,206,,False,Independent Talent Group,,"40 Whitfield Street, Bloomsbury, London W1T 2RH",2024-03-13,,Apr07_25,,Presenting radio shows on LBC - Independent Talent Group,,,,,,,,
4860,Employment and earnings,2024-04-25,,False,True,Commissioner of the Key Worker Homes Fund,https://interests-api.parliament.uk/api/v1/Interests/4860,Paul Holmes,4803,,False,Skyroom London Ltd,,"25 Moorgate, London EC2R 6AY",2021-03-26,,Apr07_25,,Commissioner of the Key Worker Homes Fund - Skyroom London Ltd,,,,,,,,
9112,Employment and earnings,2024-07-04,,False,True,Member,https://interests-api.parliament.uk/api/v1/Interests/9112,Sean Woodcock,5328,,False,Cherwell District Council,Local Authority,"Bodicote House, White Post Road, Bodicote, Banbury, Oxon OX15 4BN",2024-08-04,2024-08-01,Aug04_24,,Member - Cherwell District Council,,,,,,,,
9956,Employment and earnings,2024-09-11,,False,True,Consultant,https://interests-api.parliament.uk/api/v1/Interests/9956,Victoria Collins,5201,,False,Daggerwing Group Limited,Consultancy services,"Bankside 3, 90 - 100 Southwark Street, London SE1 0SW",2024-08-04,2024-08-04,Aug04_24,,Consultant - Daggerwing Group Limited,,,,,,,,
6866,Employment and earnings,,,False,False,Councillor,https://interests-api.parliament.uk/api/v1/Interests/6866,Will Stone,5035,,False,Swindon Borough council,,"Civic Offices, Euclid St, Swindon SN12JH",2024-07-22,2024-07-22,Aug04_24,,Councillor - Swindon Borough council,,,,,,,,
6093,Employment and earnings,,,False,False,Councillor,https://interests-api.parliament.uk/api/v1/Interests/6093,Mr Richard Quigley,5144,,False,Isle of Wight Council,,"County Hall High Street, Newport IW PO30 1UD",2024-07-17,2024-07-11,Aug04_24,,Councillor - Isle of Wight Council,,,,,,,,
6145,Employment and earnings,2024-07-05,,False,True,Councillor,https://interests-api.parliament.uk/api/v1/Interests/6145,Sean Woodcock,5328,,False,Cherwell District Council,Local Authority,"Bodicote House, White Post Road, Bodicote, Banbury, OX15 4AA",2024-07-11,2024-07-11,Aug04_24,,Councillor - Cherwell District Council,,,,,,,,
3799,Employment and earnings,,,False,False,Appearances on Talk TV,https://interests-api.parliament.uk/api/v1/Interests/3799,Sir Alec Shelbrooke,3997,,False,News UK,,"PO Box 151, Peterborough PE7 8YT",2024-03-18,,Aug04_24,,Appearances on Talk TV,,,,,,,,
4288,Employment and earnings,,,False,False,Recording podcast episodes,https://interests-api.parliament.uk/api/v1/Interests/4288,Clive Lewis,4500,,False,Persephonica Ltd,,"DS House, 306 High Street, Croydon CR0 1NG",2024-03-18,,Aug04_24,,Recording podcast episodes,,,,,,,,
4400,Employment and earnings,,,False,False,Hosting an LBC show,https://interests-api.parliament.uk/api/v1/Interests/4400,Angela Rayner,4356,,False,Global Radio Services Limited,,"30 Leicester Square, London WC2H 7LA",2024-03-18,,Aug04_24,,Hosting an LBC show,,,,,,,,
4106,Employment and earnings,,,False,False,Surveys,https://interests-api.parliament.uk/api/v1/Interests/4106,Sammy Wilson,1593,,False,YouGov,,"50 Featherstone Street, London EC1Y 8RT",2024-03-18,,Aug04_24,,Surveys,,,,,,,,
3894,Employment and earnings,,,False,False,Speaking at the Edinburgh International Book Festival,https://interests-api.parliament.uk/api/v1/Interests/3894,Chris Bryant,1446,,False,Edinburgh International Book Festival,,"121 George Street, Edinburgh EH2 4YN",2024-03-18,,Aug04_24,,Speaking at the Edinburgh International Book Festival,,,,,,,,
4972,Employment and earnings,,,False,False,Marketing advice,https://interests-api.parliament.uk/api/v1/Interests/4972,Mark Pritchard,1576,,False,Redway AG,An engineering and technical services company and a client of MAP Advisory Ltd.,"Oberer Graben 4-6, 9001, St Gallen, Switzerland",2024-03-18,2024-01-17,Aug04_24,,Marketing advice,,,,,,,,
4349,Employment and earnings,,,False,False,Panellist,https://interests-api.parliament.uk/api/v1/Interests/4349,Caroline Nokes,4048,,False,News UK & Ireland Limited,,"PO Box 151, Peterborough PE7 8YT",2024-03-18,,Aug04_24,,Panellist,,,,,,,,
4085,Employment and earnings,,,False,False,Surveys,https://interests-api.parliament.uk/api/v1/Interests/4085,Sammy Wilson,1593,,False,Savanta ComRes,,"3 Melville Street, Edinburgh EH3 7PE",2024-03-18,,Aug04_24,,Surveys,,,,,,,,
4379,Employment and earnings,,,False,False,Broadcast appearance,https://interests-api.parliament.uk/api/v1/Interests/4379,Lucy Powell,4263,,False,ITV Studios,,"Orange Tower, MediaCity UK, Manchester M50 2HE",2024-03-18,,Aug04_24,,Broadcast appearance,,,,,,,,
4967,Employment and earnings,,,False,False,Market research services,https://interests-api.parliament.uk/api/v1/Interests/4967,Mark Pritchard,1576,,False,39th Street Strategies LLC,,"9801 67th Avenue, New York, USA",2024-03-18,,Aug04_24,,Market research services,,,,,,,,
4120,Employment and earnings,,,False,False,Delivering a development programme session,https://interests-api.parliament.uk/api/v1/Interests/4120,Dawn Butler,1489,,False,Eden & Partners Ltd,,"50 Broadway, London SW1H 0RG",2024-03-18,,Aug04_24,,Delivering a development programme session,,,,,,,,
4087,Employment and earnings,,,False,False,Surveys,https://interests-api.parliament.uk/api/v1/Interests/4087,Sammy Wilson,1593,,False,Yonder Consulting,,"Northburgh House, 10 Northburgh Street, London EC1V 0AT",2024-03-18,,Aug04_24,,Surveys,,,,,,,,
4830,Employment and earnings,,,False,False,Television appearance,https://interests-api.parliament.uk/api/v1/Interests/4830,Barry Gardiner,146,,False,GB News,,"Riverbank House, 2 Swan Lane, London EC4R 3TT",2024-03-18,,Aug04_24,,Television appearance,,,,,,,,
3885,Employment and earnings,,,False,False,Presenting a show,https://interests-api.parliament.uk/api/v1/Interests/3885,Chris Bryant,1446,,False,Global Radio,,"30 Leicester Square, London WC2H 7LA",2024-03-18,,Aug04_24,,Presenting a show,,,,,,,,
