id,category,end_date,has_sought_acoba_advice,is_paid_as_director_of_payer,is_until_further_notice,job_title,link,member,mnis_id,parent_interest_id,payer_is_private_individual,payer_name,payer_nature_of_business,payer_public_address,published,registered,source_archive,start_date,summary,twfy_id,updated_1,updated_2,updated_3,updated_4,updated_5,updated_6,updated_7
7072,Employment and earnings,2024-07-05,,False,True,Governance Advisor,https://interests-api.parliament.uk/api/v1/Interests/7072,Joe Robertson,5255,,False,Dementia UK,UK Charity,"1 Aldgate, London EC3N 1RE",2024-08-01,2024-08-01,Apr07_25,,Governance Advisor - Dementia UK,,,,,,,,
6848,Employment and earnings,,,False,False,District Councillor,https://interests-api.parliament.uk/api/v1/Interests/6848,Charlie Maynard,5325,,False,West Oxfordshire District Council,District Council,"Wood Green, Witney, Oxon, OX28 1NB",2024-08-01,2024-08-01,Apr07_25,,District Councillor - West Oxfordshire District Council,,,,,,,,
9025,Employment and earnings,2024-06-30,,False,True,Senior Manager at Tech Firm,https://interests-api.parliament.uk/api/v1/Interests/9025,Louise Sandher-Jones,5258,,False,McKenzie Intelligence Services,Insurtech analysing the impact of natural disasters,"29 Throgmorton Street, London EC2N 2AT",2024-08-01,2024-08-01,Apr07_25,,Senior Manager at Tech Firm - McKenzie Intelligence Services,,,,,,,,
7413,Employment and earnings,2024-07-05,,True,True,Executive Director,https://interests-api.parliament.uk/api/v1/Interests/7413,Laura Kyrke-Smith,5341,,False,International Rescue Committee UK,,"100 Wood Street, London EC2V 7AN",2024-08-01,2024-08-01,Apr07_25,,Executive Director - International Rescue Committee UK,,,,,,,,
6539,Employment and earnings,2024-07-12,,False,True,Head of Charity Fundraising,https://interests-api.parliament.uk/api/v1/Interests/6539,Ian Roome,5138,,False,Royal Devon University Healthcare NHS Foundation Trust,NHS Trust,"Wonford, Barrack Road, Exeter EX2 5DW",2024-07-31,2024-07-31,Apr07_25,,Head of Charity Fundraising - Royal Devon University Healthcare NHS Foundation Trust,,,,,,,,
6275,Employment and earnings,,,True,False,Company Director,https://interests-api.parliament.uk/api/v1/Interests/6275,Aphra Brandreth,5241,,False,Smart Vet Ltd (trading as Pet People),Veterinary Clinics,"Central House, 124 High Street, Hampton Hill TW12 1NS",2024-07-31,2024-07-31,Apr07_25,,Company Director - Smart Vet Ltd (trading as Pet People),,,,,,,,
8187,Employment and earnings,,,False,False,Central Bedfordshire Councillor,https://interests-api.parliament.uk/api/v1/Interests/8187,Blake Stephenson,5100,,False,Central Bedfordshire Council,Local Authority,"Priory House, Monks Walk, Chicksands, Bedfordshire SG17 5TQ",2024-07-31,2024-07-31,Apr07_25,,Central Bedfordshire Councillor - Central Bedfordshire Council,,,,,,,,
7173,Employment and earnings,2024-07-31,False,False,True,Project Manager,https://interests-api.parliament.uk/api/v1/Interests/7173,Matt Turmaine,5130,,False,Hertfordshire County Council,,"County Hall, Pegs Lane, Hertford, Hertfordshire SG13 8DF",2024-07-31,2024-07-31,Apr07_25,,Project Manager - Hertfordshire County Council,,,,,,,,
6468,Employment and earnings,2024-07-05,,False,True,Compliance Officer,https://interests-api.parliament.uk/api/v1/Interests/6468,Blake Stephenson,5100,,False,London Stock Exchange Group,,"10 Paternoster Square, London EC4M 7LS",2024-07-31,2024-07-31,Apr07_25,,Compliance Officer - London Stock Exchange Group,,,,,,,,
6012,Employment and earnings,2024-07-06,,False,True,Employment,https://interests-api.parliament.uk/api/v1/Interests/6012,Dan Tomlinson,5282,,False,Joseph Rowntree Foundation,,"40 Water End, York YO30 6WP",2024-07-31,2024-07-31,Apr07_25,,Employment - Joseph Rowntree Foundation,,,,,,,,
6359,Employment and earnings,,,False,False,"Ward Councillor, Herefordshire Council",https://interests-api.parliament.uk/api/v1/Interests/6359,Dr Ellie Chowns,5249,,False,Herefordshire Council,,"Plough Lane, Hereford HR4 0LE",2024-07-31,2024-07-31,Apr07_25,,"Ward Councillor, Herefordshire Council - Herefordshire Council",,,,,,,,
8149,Employment and earnings,2024-07-04,False,False,True,Deputy CEO,https://interests-api.parliament.uk/api/v1/Interests/8149,Joe Powell,5229,,False,Open Government Partnership,Registered Charity,"1 Horse Guards Avenue, London SW1A 2ER",2024-07-31,2024-07-31,Apr07_25,,Deputy CEO - Open Government Partnership,,,,,,,,
6736,Employment and earnings,,,False,False,Provost and Councillor,https://interests-api.parliament.uk/api/v1/Interests/6736,Douglas McAllister,5057,,False,West Dunbartonshire,,"Church St, Dumbarton G82 1QL",2024-07-31,2024-07-31,Apr07_25,,Provost and Councillor - West Dunbartonshire,,,,,,,,
6289,Employment and earnings,,,False,False,Councillor at Gravesham Borough Council,https://interests-api.parliament.uk/api/v1/Interests/6289,Dr Lauren Sullivan,5269,,False,Gravesham Borough Council,,"Civic Centre, Gravesend, Kent DA12 1AU",2024-07-31,2024-07-31,Apr07_25,,Councillor at Gravesham Borough Council - Gravesham Borough Council,,,,,,,,
8060,Employment and earnings,2024-07-04,,False,True,Finance Director,https://interests-api.parliament.uk/api/v1/Interests/8060,Chris Coghlan,5198,,False,Access-The Foundation for Social Investment,UK registered charity,"8-10 New Fetter Lane, London EC4A 1AZ",2024-07-30,2024-07-30,Apr07_25,,Finance Director - Access-The Foundation for Social Investment,,,,,,,,
6299,Employment and earnings,2024-07-25,,False,True,Employee - Chief Executive,https://interests-api.parliament.uk/api/v1/Interests/6299,Martin Rhodes,5251,,False,Scottish Fair Trade Forum,Registered charity and company limited by guarantee promoting Fair Trade,"Robertson House, 152 Bath Street, Glasgow G2 4TB",2024-07-30,2024-07-30,Apr07_25,,Employee - Chief Executive - Scottish Fair Trade Forum,,,,,,,,
6292,Employment and earnings,2024-07-08,,False,True,Senior Associate,https://interests-api.parliament.uk/api/v1/Interests/6292,James McMurdock,5361,,False,Standard Chartered Bank,Bank,"1 Basinghall Avenue, London, EC2V 5DD",2024-07-30,2024-07-30,Apr07_25,,Senior Associate - Standard Chartered Bank,,,,,,,,
7158,Employment and earnings,2024-11-30,,False,True,Elected Member of East Dunbartonshire Council,https://interests-api.parliament.uk/api/v1/Interests/7158,Susan Murray,5157,,False,East Dunbartonshire Council,I have now resigned as an elected member of East Dunbartonshire Council,"Southbank Marina, 12 Strathkelvin Place, Kirkintilloch, Glasgow, G66 1TJ",2024-07-30,2024-07-30,Apr07_25,,Elected Member of East Dunbartonshire Council - East Dunbartonshire Council,,2024-12-16,,,,,,
6567,Employment and earnings,2024-07-05,,False,True,Partner,https://interests-api.parliament.uk/api/v1/Interests/6567,Olivia Bailey,5337,,False,Public First,,"20 Victoria Street, London SW1H 0NB",2024-07-30,2024-07-30,Apr07_25,,Partner - Public First,,,,,,,,
7931,Employment and earnings,2024-07-05,,False,True,"Head of Research, Policy and External Relations",https://interests-api.parliament.uk/api/v1/Interests/7931,Kate Dearden,5224,,False,Community trade union,,"465c Caledonian Road, London N7 9GX",2024-07-30,2024-07-30,Apr07_25,,"Head of Research, Policy and External Relations - Community trade union",,,,,,,,
7404,Employment and earnings,2024-09-15,,False,True,Professor,https://interests-api.parliament.uk/api/v1/Interests/7404,Pam Cox,5042,,False,University of Essex,,"Wivenhoe Park, Colchester CO4 3SQ",2024-07-30,2024-07-30,Apr07_25,,Professor - University of Essex,,,,,,,,
6285,Employment and earnings,2024-07-05,,False,True,Post-doctoral researcher,https://interests-api.parliament.uk/api/v1/Interests/6285,Peter Swallow,5165,,False,Durham University,University,"The Palatine Centre, University, Stockton Rd, Durham DH1 3LE",2024-07-30,2024-07-30,Apr07_25,,Post-doctoral researcher - Durham University,,,,,,,,
7946,Employment and earnings,2024-07-04,,False,True,London Councils Executive Committee Member,https://interests-api.parliament.uk/api/v1/Interests/7946,Nesil Caliskan,5180,,False,London Council,,"59½ Southwark Street, London SE1 0AL",2024-07-30,2024-07-29,Apr07_25,,London Councils Executive Committee Member - London Council,,,,,,,,
6464,Employment and earnings,2024-07-08,False,False,True,Senior Researcher,https://interests-api.parliament.uk/api/v1/Interests/6464,Mr Connor Rand,5159,,False,"Union of Shop, Distributive and Allied Workers (Usdaw)",,"Quays, Voyager Building, 2 Furness Quay, Salford M503XZ",2024-07-30,2024-07-30,Apr07_25,,"Senior Researcher - Union of Shop, Distributive and Allied Workers (Usdaw)",,,,,,,,
8290,Employment and earnings,2024-07-05,,False,True,Director of Labour Together,https://interests-api.parliament.uk/api/v1/Interests/8290,Josh Simons,5060,,False,Labour Together,a political think tank,"Langley House, Park Road, East Finchley, London N2 8EY",2024-07-30,2024-07-30,Apr07_25,2022-10-01,Director of Labour Together - Labour Together,,,,,,,,
8268,Employment and earnings,2024-07-31,,False,True,Councillor,https://interests-api.parliament.uk/api/v1/Interests/8268,Brian Leishman,5196,,False,Perth and Kinross Council,Local Government.,"Pullar House, Kinnoull Street, Perth PH1 5GD",2024-07-30,2024-07-30,Apr07_25,,Councillor - Perth and Kinross Council,,2024-11-20,,,,,,
7935,Employment and earnings,2024-07-04,,True,True,Leader of the Labour Group (LGA),https://interests-api.parliament.uk/api/v1/Interests/7935,Nesil Caliskan,5180,,False,Local Government Association,,"18 Smith Square, Westminster, London SW1P 3HZ",2024-07-30,2024-07-29,Apr07_25,,Leader of the Labour Group (LGA) - Local Government Association,,,,,,,,
6453,Employment and earnings,2024-07-08,,False,True,Political Officer,https://interests-api.parliament.uk/api/v1/Interests/6453,Michael Wheeler,5242,,False,"Union of Shop, Distributive and Allied Workers",Trade Union,"Voyager Building, 2 Furness Quay, Salford Quays M50 3XZ",2024-07-30,2024-07-30,Apr07_25,,"Political Officer - Union of Shop, Distributive and Allied Workers",,,,,,,,
8196,Employment and earnings,2024-07-05,,False,True,Trade Union Official,https://interests-api.parliament.uk/api/v1/Interests/8196,Laurence Turner,5234,,False,GMB Union,,"22 Stephenson Way, London NW1 2HD",2024-07-30,2024-07-30,Apr07_25,,Trade Union Official - GMB Union,,,,,,,,
6662,Employment and earnings,2024-08-21,,True,True,Board Member,https://interests-api.parliament.uk/api/v1/Interests/6662,Chris Kane,5155,,False,Loch Lomond and the Trossachs National Park,,"Carrochan Road, Balloch G63 8EG",2024-07-30,2024-07-30,Apr07_25,,Board Member - Loch Lomond and the Trossachs National Park,,2024-09-14,,,,,,
7521,Employment and earnings,,,False,False,City Councillor,https://interests-api.parliament.uk/api/v1/Interests/7521,David Williams,5151,,False,Stoke-on-Trent City Council,,"Civic Centre, Glebe Street, ST4 1HH",2024-07-30,2024-07-30,Apr07_25,,City Councillor - Stoke-on-Trent City Council,,,,,,,,
6886,Employment and earnings,2024-07-05,,False,True,Senior Public Affairs Officer,https://interests-api.parliament.uk/api/v1/Interests/6886,Tom Rutland,5222,,False,Prospect trade union,,"100 Rochester Row, London SW1P 1JP",2024-07-30,2024-07-30,Apr07_25,,Senior Public Affairs Officer - Prospect trade union,,,,,,,,
6644,Employment and earnings,2024-07-09,,False,True,Humanities Teacher,https://interests-api.parliament.uk/api/v1/Interests/6644,Tristan Osborne,5220,,False,Endeavour Multi-Academy Trust,Education,"Parsons Lane, Wilmington, Kent DA2 7BB",2024-07-30,2024-07-30,Apr07_25,,Humanities Teacher - Endeavour Multi-Academy Trust,,,,,,,,
6019,Employment and earnings,2024-07-05,False,False,True,Trade Union Official,https://interests-api.parliament.uk/api/v1/Interests/6019,Neil Duncan-Jordan,5359,,False,UNISON,,"130 Euston Road, London NW1 2AY",2024-07-29,2024-07-29,Apr07_25,,Trade Union Official - UNISON,,,,,,,,
7921,Employment and earnings,2024-07-31,,False,True,Council Leader,https://interests-api.parliament.uk/api/v1/Interests/7921,Nesil Caliskan,5180,,False,London Borough of Enfield,,"Civic Centre Silver Street, London EN1 3XA, United Kingdom",2024-07-29,2024-07-29,Apr07_25,,Council Leader - London Borough of Enfield,,,,,,,,
6635,Employment and earnings,2024-07-05,,False,True,Assistant General Secretary,https://interests-api.parliament.uk/api/v1/Interests/6635,Emma Foody,5029,,False,Co-operative Party,Political Party,"U13, 83 Crampton Street, London SE17 3BQ",2024-07-29,2024-07-29,Apr07_25,,Assistant General Secretary - Co-operative Party,,,,,,,,
6345,Employment and earnings,2024-08-30,,False,True,Local councillor,https://interests-api.parliament.uk/api/v1/Interests/6345,Seamus Logan,5280,,False,Aberdeenshire Council,,"Woodhill House, Westburn Road AB16 5GB",2024-07-29,2024-07-29,Apr07_25,,Local councillor - Aberdeenshire Council,,,,,,,,
6622,Employment and earnings,2024-05-22,,False,True,Self employed consultant,https://interests-api.parliament.uk/api/v1/Interests/6622,Ms Julie Minns,5094,,False,Family Rights Group,Charity,"101 Pentonville Road, London N1 9LG",2024-07-29,2024-07-29,Apr07_25,,Self employed consultant - Family Rights Group,,,,,,,,
7095,Employment and earnings,2024-07-31,,False,True,Head of Adviceline,https://interests-api.parliament.uk/api/v1/Interests/7095,Natalie Fleet,5053,,False,National Education Union,,"Hamilton House, Mabledon Place, London WC1H 9BD",2024-07-29,2024-07-29,Apr07_25,,Head of Adviceline - National Education Union,,,,,,,,
7725,Employment and earnings,2024-09-26,,False,True,"Councillor, West Lothian Council",https://interests-api.parliament.uk/api/v1/Interests/7725,Kirsteen Sullivan,5179,,False,West Lothian Council,Local government,"Civic Centre, Howden South Rd, Livingston EH54 6FF",2024-07-29,2024-07-29,Apr07_25,,"Councillor, West Lothian Council - West Lothian Council",,2024-10-24,,,,,,
7653,Employment and earnings,2024-07-05,,False,True,Public Affairs Director,https://interests-api.parliament.uk/api/v1/Interests/7653,Jade Botterill,5236,,False,Portland,Communications agency,"Bankside 3, 90 - 100 Southwark Street, London SE1 0SW",2024-07-29,2024-07-29,Apr07_25,,Public Affairs Director - Portland,,,,,,,,
7955,Employment and earnings,2024-07-04,,False,True,Teacher,https://interests-api.parliament.uk/api/v1/Interests/7955,Jodie Gosling,5036,,False,Coventry City Council,Primary school,"Joseph Cash Primary School, Owenford Rd, Coventry CV63FS",2024-07-29,2024-07-29,Apr07_25,,Teacher - Coventry City Council,,,,,,,,
7719,Employment and earnings,2024-07-05,,False,True,Partner in law firm,https://interests-api.parliament.uk/api/v1/Interests/7719,Lucy Rigby,5333,,False,Hausfeld & Co LLP,Law firm,"12 Gough Square, London EC4A 3DW",2024-07-29,2024-07-29,Apr07_25,,Partner in law firm - Hausfeld & Co LLP,,,,,,,,
6884,Employment and earnings,2024-08-23,,False,True,Member,https://interests-api.parliament.uk/api/v1/Interests/6884,Mr Joshua Reynolds,5343,,False,Berkshire Fire Authority,,"Pincents Kiln Industrial Park, Newsham Court, Calcot, Reading RG31 7SD",2024-07-29,2024-07-29,Apr07_25,,Member - Berkshire Fire Authority,,2024-09-02,,,,,,
7883,Employment and earnings,,,False,False,Councillor,https://interests-api.parliament.uk/api/v1/Interests/7883,Sam Carling,5308,,False,Cambridge City Council,,"The Guildhall, Market Square, Cambridge CB2 3QJ",2024-07-29,2024-07-29,Apr07_25,,Councillor - Cambridge City Council,,,,,,,,
7748,Employment and earnings,,,False,False,Work as a solicitor.,https://interests-api.parliament.uk/api/v1/Interests/7748,Warinder Juss,5230,,False,Thompsons Solicitors LLP,,"Congress House, Great Russell Street, London WC1B 3LW",2024-07-29,2024-07-29,Apr07_25,,Work as a solicitor. - Thompsons Solicitors LLP,,,,,,,,
6576,Employment and earnings,,,False,False,Councillor,https://interests-api.parliament.uk/api/v1/Interests/6576,Frank McNally,5183,,False,North Lanarkshire Council,,"Civic Centre, Windmillhill Street, Motherwell, ML1 1AB",2024-07-29,2024-07-29,Apr07_25,2024-08-06,Councillor - North Lanarkshire Council,,2024-08-31,,,,,,
5991,Employment and earnings,2024-05-30,,False,True,Public Affairs Director,https://interests-api.parliament.uk/api/v1/Interests/5991,Chris Ward,5276,,False,Hanbury Strategy,Public Affairs,"2 London Bridge, London SE1 9RA",2024-07-29,2024-07-29,Apr07_25,,Public Affairs Director - Hanbury Strategy,,,,,,,,
7745,Employment and earnings,,,False,False,Energy markets transaction advisory.,https://interests-api.parliament.uk/api/v1/Interests/7745,Jack Rankin,5340,,False,Pexapark (UK) Limited,Renewable energy advisory and software company.,"c/o BDO LLP, 55 Baker Street, London W1U 7EU",2024-07-29,2024-07-29,Apr07_25,,Energy markets transaction advisory. - Pexapark (UK) Limited,,,,,,,,
6579,Employment and earnings,2024-07-08,,False,True,Parliamentary Aide,https://interests-api.parliament.uk/api/v1/Interests/6579,Frank McNally,5183,,False,Mark Griffin MSP,,"The Scottish Parliament, The Royal Mile, Edinburgh EH99 1SP",2024-07-29,2024-07-29,Apr07_25,,Parliamentary Aide - Mark Griffin MSP,,,,,,,,
8014,Employment and earnings,2024-07-05,,False,True,Partner in communications agency,https://interests-api.parliament.uk/api/v1/Interests/8014,Gregor Poynton,5167,,False,Headland Consultancy,"Agency supporting clients' financial and corporate communications, public affairs and campaigning.","Cannon Green, 27 Bush Lane, London EC4R 0AA",2024-07-29,2024-07-29,Apr07_25,,Partner in communications agency - Headland Consultancy,,,,,,,,
7732,Employment and earnings,2024-07-05,,False,True,District Councillor,https://interests-api.parliament.uk/api/v1/Interests/7732,Jo White,5105,,False,Bassetlaw District Council,,"Queen's Buildings, Potter Street, Worksop S80 1PH",2024-07-29,2024-07-29,Apr07_25,,District Councillor - Bassetlaw District Council,,,,,,,,
7509,Employment and earnings,2024-07-05,,False,True,Trade Union Organiser,https://interests-api.parliament.uk/api/v1/Interests/7509,Lola McEvoy,5037,,False,GMB Union,,"St James Business Park, 81 Linwood Road, Paisley PA3 3BB",2024-07-29,2024-07-29,Apr07_25,,Trade Union Organiser - GMB Union,,,,,,,,
6849,Employment and earnings,2024-07-15,,False,True,Elected Councillor,https://interests-api.parliament.uk/api/v1/Interests/6849,Margaret Mullane,5272,,False,London Borough of Barking and Dagenham,Barking and Dagenham Council,"Town Hall, Barking, Essex",2024-07-29,2024-07-29,Apr07_25,,Elected Councillor - London Borough of Barking and Dagenham,,,,,,,,
8046,Employment and earnings,2024-11-30,True,False,True,Strategic Advisor to the Cannabinoid Research and Development Group (CRDG) at the Centre for Medicinal Cannabis (CMC).,https://interests-api.parliament.uk/api/v1/Interests/8046,George Freeman,4020,,False,The Centre for Medicinal Cannabis (CMC).,"CMC is a not for profit industry membership organisation focused on clinical research and development of cannabinoid medicines. The Centre has three platforms with the following trading names: The Association for the Cannabinoid Industry (ACI), which relates to cannabinoids as a food ingredient; The Medical Cannabis Alliance (MCA), which is for Cannabis Based Medical Products; and Cannabinoid Research and Development Group (CRDG)","10 Queen Street Place, London, England EC4R 1BE.",2024-07-29,2024-07-29,Apr07_25,2024-04-05,Strategic Advisor to the Cannabinoid Research and Development Group (CRDG) at the Centre for Medicinal Cannabis (CMC). - The Centre for Medicinal Cannabis (CMC).,,2024-12-03,,,,,,
7768,Employment and earnings,2024-07-04,,False,True,Co-leader of the Green Party of England and Wales,https://interests-api.parliament.uk/api/v1/Interests/7768,Carla Denyer,5102,,False,The Green Party of England and Wales,Political party,"PO Box 78066, London, SE16 9GQ",2024-07-29,2024-07-29,Apr07_25,2021-10-01,Co-leader of the Green Party of England and Wales - The Green Party of England and Wales,,,,,,,,
7576,Employment and earnings,2024-07-04,,False,True,Chief Executive,https://interests-api.parliament.uk/api/v1/Interests/7576,Torsten Bell,5069,,False,Resolution Foundation,Charity,"2 Queen Anne's Gate, London SW1H 9AA",2024-07-26,2024-07-26,Apr07_25,,Chief Executive - Resolution Foundation,,,,,,,,
7119,Employment and earnings,2024-07-31,,True,True,Director,https://interests-api.parliament.uk/api/v1/Interests/7119,Gideon Amos,5250,,False,AEC Ltd,Chartered Architects and Town Planners,"198 High Street, Tonbridge, Kent TN9 1BE",2024-07-26,2024-07-26,Apr07_25,,Director - AEC Ltd,,,,,,,,
6467,Employment and earnings,2024-07-07,,False,True,Communications Officer,https://interests-api.parliament.uk/api/v1/Interests/6467,Jacob Collier,5077,,False,Nottinghamshire and City of Nottingham Fire Authority,Fire and rescue service,"Nottinghamshire Fire and Rescue Fire Service, Joint Headquarters, Sherwood Lodge, Arnold, Nottingham NG5 8PP",2024-07-26,2024-07-26,Apr07_25,,Communications Officer - Nottinghamshire and City of Nottingham Fire Authority,,,,,,,,
6001,Employment and earnings,2024-07-05,,False,True,Product Owner Hydrogen UK,https://interests-api.parliament.uk/api/v1/Interests/6001,Tom Collins,5087,,False,Bosch Thermotechnology Ltd,"Worcester Bosch, manufacturer of domestic, commercial and industrial HVAC equipment.","Cotswold Way, Worcester WR4 9SW",2024-07-26,2024-07-26,Apr07_25,,Product Owner Hydrogen UK - Bosch Thermotechnology Ltd,,,,,,,,
7589,Employment and earnings,2024-09-30,True,False,True,Adviser to Henham Strategy on UK Science & Technology Investment,https://interests-api.parliament.uk/api/v1/Interests/7589,George Freeman,4020,,False,Henham Strategy LTD,"Henham Strategy is a specialist private sector consultancy with a growing client base in UK science and technology investment, in particular helping UK sectors, clusters and companies looking to attract inward investment","35-37 Ludgate Hill, London, England EC4M 7JN",2024-07-26,2024-07-26,Apr07_25,2024-05-23,Adviser to Henham Strategy on UK Science & Technology Investment - Henham Strategy LTD,,2024-09-11,2024-10-15,,,,,
6957,Employment and earnings,2024-07-05,,False,True,Head of nursing,https://interests-api.parliament.uk/api/v1/Interests/6957,Sojan Joseph,5247,,False,Kent and Medway NHS trust,,"Eastern and Costal area offices, Littlebourne Road, Canterbury CT1 1AZ",2024-07-26,2024-07-26,Apr07_25,,Head of nursing - Kent and Medway NHS trust,,,,,,,,
6685,Employment and earnings,2024-07-05,,True,True,Director and CEO of consultancy company,https://interests-api.parliament.uk/api/v1/Interests/6685,Andy MacNae,5134,,True,Venture Xtreme Consultancy Limited,,,2024-07-25,2024-07-25,Apr07_25,,Director and CEO of consultancy company - Venture Xtreme Consultancy Limited,,,,,,,,
7340,Employment and earnings,2024-07-05,,False,True,Strategy Advisor NHS England,https://interests-api.parliament.uk/api/v1/Interests/7340,Kevin McKenna,5300,,False,NHS England,NHS,"NHS England, Wellington House, London SE1 8EG",2024-07-25,2024-07-25,Apr07_25,,Strategy Advisor NHS England - NHS England,,,,,,,,
7265,Employment and earnings,2024-09-06,,False,True,Borough Councillor.,https://interests-api.parliament.uk/api/v1/Interests/7265,Sojan Joseph,5247,,False,Ashford Borough council,Local government.,"Civic Centre, Tannery Ln, Ashford TN23 1PL",2024-07-25,2024-07-25,Apr07_25,2023-05-05,Borough Councillor. - Ashford Borough council,,2024-09-19,,,,,,
7483,Employment and earnings,2024-07-06,,False,True,Director of Communications,https://interests-api.parliament.uk/api/v1/Interests/7483,Andrew Lewin,5061,,False,Clarion Housing Group,,"6 More, London SE1 2DA",2024-07-25,2024-07-25,Apr07_25,,Director of Communications - Clarion Housing Group,,,,,,,,
7324,Employment and earnings,2024-07-05,,True,True,Solicitor,https://interests-api.parliament.uk/api/v1/Interests/7324,Rachel Taylor,5065,,False,Rachel Taylor Consultancy Limited,Providing legal services to local solicitors firms including Evans Derry Solicitors,"The Old College, Ratcliffe Road, Atherstone, Warwickshire CV9 1LF",2024-07-25,2024-07-25,Apr07_25,,Solicitor - Rachel Taylor Consultancy Limited,,,,,,,,
6068,Employment and earnings,,,False,False,Lecturer,https://interests-api.parliament.uk/api/v1/Interests/6068,Sarah Gibson,5239,,False,University of Bath,University,"The University of Bath, Claverton Down, Bath BA2 7AY",2024-07-25,2024-07-25,Apr07_25,,Lecturer - University of Bath,,,,,,,,
6526,Employment and earnings,2024-06-29,,True,True,Director,https://interests-api.parliament.uk/api/v1/Interests/6526,Freddie van Mierlo,5296,,True,Mochico,Provides advisory services to clients,,2024-07-25,2024-07-25,Apr07_25,,Director - Mochico,,2024-10-01,,,,,,
7327,Employment and earnings,,,False,False,Elected Councillor,https://interests-api.parliament.uk/api/v1/Interests/7327,Rachel Taylor,5065,,False,North Warwickshire Borough Council,District Council,"The Council House, South Street, Atherstone, Warwickshire CV9 1DE",2024-07-25,2024-07-25,Apr07_25,,Elected Councillor - North Warwickshire Borough Council,,,,,,,,
6238,Employment and earnings,,,False,False,Highland Councillor,https://interests-api.parliament.uk/api/v1/Interests/6238,Mr Angus MacDonald,5362,,False,Highland Council,,"Glenurquart Road, Inverness IV3 5NX",2024-07-24,2024-07-24,Apr07_25,,Highland Councillor - Highland Council,,,,,,,,
7125,Employment and earnings,2024-07-17,False,False,True,Leader of South Gloucestershire Council,https://interests-api.parliament.uk/api/v1/Interests/7125,Claire Young,5140,,False,South Gloucestershire Council,,"Department for Resources and Business Change, PO Box 1953, Bristol BS37 0DE",2024-07-24,2024-07-24,Apr07_25,,Leader of South Gloucestershire Council - South Gloucestershire Council,,,,,,,,
7183,Employment and earnings,2024-07-05,,False,True,Chief Executive Officer (CEO),https://interests-api.parliament.uk/api/v1/Interests/7183,Tom Hayes,5210,,False,Elmore Community Services,Mental health and domestic abuse charity,"213 Barns Road, Oxford OX4 3UT",2024-07-24,2024-07-24,Apr07_25,,Chief Executive Officer (CEO) - Elmore Community Services,,,,,,,,
